kp,#sentences,sentences_coverage,#comments,comments_coverage
none,35,0.7291666666666666,28,0.8
The application principally concerns torture and inhuman conditions of detention.,4,0.08333333333333333,4,0.11428571428571428
The purported remedies were thus ineffective for the following reasons:,3,0.0625,3,0.08571428571428572
Doctors must be free to give.,2,0.041666666666666664,2,0.05714285714285714
"However, the applicant alleged that doctors have been intimidated, as.",2,0.041666666666666664,2,0.05714285714285714
"The applicant submitted that any purported remedy is illusory, inadequate and ineffective.",2,0.041666666666666664,2,0.05714285714285714
