id,name,argument
1,11.txt,not having applied for judicial review either of the Inspectors’ conduct of the inquiry or of their decision to submit their report to the Secretary of State;
2,11.txt,by not having applied for judicial review of the Secretary of State’s decision to publish the Inspectors’ report;
3,11.txt,"by not having pursued the libel proceedings commenced against The Observer newspaper."
4,11.txt,"The grounds on which judicial review may be sought (see paragraphs 44 and 45 above) are such that it would not have ensured access to a court for determination of the truth of statements made about the applicants in the Inspectors’ report, the absence of such access being the essence of their complaints under the Convention."
5,11.txt,"Nor would the libel actions against The Observer, although to some extent concerned with the same subject-matter (see paragraph 11 above), have provided a remedy against the Inspectors or the Secretary of State as regards the publication of the damaging statements contained in the Inspectors’ report."
6,11.txt," The applicants contended that the Inspectors’ investigation and, above all, the publication of the Inspectors’ report gave rise to a violation of Article 6 para. 1 (art. 6-1), which, in so far as relevant, provides:"
7,11.txt,"The first stage of the applicants’ argument, which was disputed by the Government and not accepted by the Commission, was that"
8,11.txt," In order for an individual to be entitled to a hearing before a tribunal, there must exist a ""dispute"" (""contestation"") over one of his or her civil rights or obligations."
9,11.txt,"(see, inter alia, the Le Compte, Van Leuven and De Meyere v. Belgium judgment of 23 June 1981, Series A no. 43, pp. 20-22, paras. 44-50)."
10,11.txt,"the respondent Government did not dispute the existence and ""civil"" character of the right under English law to a good reputation."
11,11.txt,"The principal purpose of the investigation and report of the Inspectors, they maintained, was to acquire, marshal and set down factual information which would enable the various competent authorities - such as the Director General of Fair Trading, the prosecuting authorities, the Bank of England, the Takeover Panel and the Secretary of State (see paragraphs 23, 27, 30 and 34 above) - to decide what action, if any, to take. "
12,11.txt,"Four further purposes also existed, none of which, however, included ascertaining whether the applicants merited their good reputation. These additional purposes were dispelling public speculation about the events surrounding the takeover, enabling those concerned in takeovers to learn lessons, laying the foundations for reform of company law and practice, and providing information to HOF’s employees, shareholders and creditors."
13,11.txt,"The Commission, after analysing the purposes served by the preparation and publication of the Inspectors’ report, came to the conclusion that the Inspectors had an ""investigative rather than determinative"" role (paragraph 64 of the Commission’s report)."
14,11.txt,The Court notes that under the terms of section 432 (2) of the Companies Act 1985 Inspectors can only be appointed if it appears to the Secretary of State that there are circumstances suggesting one or more types of specified wrongdoing or unlawful action in the conduct of a company’s affairs (see paragraph 36 above).
15,11.txt,"The Act confers on the Inspectors wide powers to obtain information and obstruction of the Inspectors may, upon reference by them to a court, be treated by it as a contempt of court and punished accordingly (sections 434 and 436 of the Act - see paragraph 38 above)."
16,11.txt,"The principal question addressed by the Inspectors in the instant case can be reduced to whether the Fayed brothers had dishonestly misled the authorities and the public in order to obtain Government clearance and acceptance by the HOF Board of their bid (see paragraphs 13 and 14 above). The Inspectors’ published findings - that the applicants had indeed made dishonest representations concerning their origins, their wealth, their business interests and their resources and had thereafter knowingly submitted false evidence to the Inspectors (see paragraph 22 above) - undoubtedly damaged the applicants’ reputations."
17,11.txt,"The competent Ministers and a Parliamentary Select Committee - quite apart, it can be supposed, from a substantial section of public opinion - showed a disposition to accept as correct these findings, publication of which was seen as a kind of sanction (see paragraphs 26, 30, 31, 33 and 34 above).
Such elements or consequences are, it is true, not infrequently found in the context of adjudicatory proceedings."
18,11.txt,"However, the Court is satisfied that the functions performed by the Inspectors were, in practice as well as in theory, essentially investigative"
19,11.txt,(see the similar analysis by the Supreme Court of the United States of America of the function of the Federal Civil Rights Commission in the case of Hannah v. Larche (363 US 420 (1960)).
20,11.txt,They themselves said in their report that their findings would not be dispositive of anything (see paragraph 21 above).
21,11.txt,"They did not make a legal determination as to criminal or civil liability concerning the Fayed brothers, and in particular concerning the latter’s civil right to honour and reputation."
22,11.txt,"The purpose of their inquiry was to ascertain and record facts which might subsequently be used as the basis for action by other competent authorities - prosecuting, regulatory, disciplinary or even legislative."
23,11.txt,"Lonrho admittedly exhibited a clear interest in the inquiry and its outcome, by being instrumental in bringing about the appointment of the Inspectors, by submitting evidence and by seeking to prompt action by the Secretary of State (see paragraphs 12 in fine, 13, 19, 24, 25 and 35 above)."
24,11.txt,"Nonetheless, whilst there was a close connection between Lonrho’s grievance against the Fayed brothers and the matters investigated by the Inspectors (see, inter alia, paragraphs 10-13 and 22 above), the object of the proceedings before the Inspectors was not to resolve any dispute (contestation) between Lonrho and the applicants. "
25,11.txt,"Those disputes, and in particular the applicants’ libel claims that Lonrho, through The Observer, had wrongfully damaged their reputations, were being adjudicated by the ordinary courts (see paragraphs 11 and 12 above)."
26,11.txt,"Likewise, no dispute (contestation) between the Secretary of State or the Inspectors and the applicants as to the lawfulness of any alleged interference with the applicants’ right to reputation arose merely because the applicants contested the grounds on which the Minister decided to appoint the Inspectors and on which the Inspectors conducted their lines of inquiry."
27,11.txt,"The Inspectors described Lonrho and the Fayed brothers as ""bitterly antagonistic parties"" (see paragraph 19 in fine above)."
28,11.txt,"In short, it cannot be said that the Inspectors’ inquiry ""determined"" the applicants’ civil right to a good reputation, for the purposes of Article 6 para. 1 (art. 6-1), or that its result was directly decisive for that right."
29,11.txt, Acceptance of the applicants’ argument would entail that a body carrying out preparatory investigations at the instance of regulatory or other authorities should always be subject to the guarantees of a judicial procedure set forth in Article 6 para. 1 (art. 6-1) by reason of the fact that publication of its findings is liable to damage the reputation of the individuals whose conduct is being investigated.
30,11.txt,"The Inspectors did not adjudicate, either in form or in substance."
31,11.txt,Such an interpretation of Article 6 para. 1 (art. 6-1) would in practice unduly hamper the effective regulation in the public interest of complex financial and commercial activities.
32,11.txt,"In the words of the Court’s Golder judgment, ""... Article 6 para. 1 (art. 6-1) secures to everyone the right to have any claim relating to his civil rights and obligations brought before a court or tribunal."
33,11.txt,"In this way the Article (art. 6-1) embodies the ‘right to a court’, of which the right of access, that is the right to institute proceedings before courts in civil matters, constitutes one aspect only"" (loc. cit., p. 18, para. 36)."
34,11.txt,"This right to a court ""extends only to ‘contestations’ (disputes) over (civil) ‘rights and obligations’ which can be said, at least on arguable grounds, to be recognised under domestic law;"
35,11.txt,"  In the Government’s submission, the defence of privilege delimited the very content of the applicants’ right to a good reputation as protected under English law."
36,11.txt,"They maintained that, unlike procedural barriers to access to court, such an exercise by the State of the power to fix the content of a particular civil right did not bring into play Article 6 para. 1 (art. 6-1), although it might on occasions raise an issue in relation to one or other of the substantive rights protected by the Convention (such as the right to respect for private life under Article 8) (art. 8)."
37,11.txt,  It is not always an easy matter to trace the dividing line between procedural and substantive limitations of a given entitlement under domestic law.
38,11.txt,"It may sometimes be no more than a question of legislative technique whether the limitation is expressed in terms of the right or its remedy."
39,11.txt,"If the Court were to treat the facts underlying the complaints declared admissible by the Commission as raising a substantive, rather than a procedural, complaint going to the right to respect for private life under Article 8 (art. 8) of the Convention - as it has jurisdiction to do"
40,11.txt,"The Court therefore proposes to proceed on the basis that Article 6 para. 1 (art. 6-1) is applicable to the facts of the case, the argument before the Court having been directed solely to this Article."
41,11.txt," On this approach, it has to be ascertained whether the contested limitation on the applicants’ ability to take legal proceedings to challenge the findings and conclusions in the Inspectors’ report which were damaging to their reputations satisfied the conditions stated in the Court’s case-law."
42,11.txt,"(see the Handyside v. the United Kingdom judgment of 7 December 1976, Series A no. 24, pp. 19-20, para. 41)"
43,11.txt,"The legitimacy of the limitation complained of cannot be divorced from its context, namely the system of investigation and reporting under the Companies Act 1985."
44,11.txt,The underlying aim of this system is clearly the furtherance of the public interest in the proper conduct of the affairs of public companies whose owners benefit from limited liability.
45,11.txt,"Considerations of public interest dictate both the appointment of Inspectors and the publication or not of their report (see paragraphs 36, 40 and 41 above)."
46,11.txt,"The system contributes to safeguarding the interests of the various parties concerned in the affairs of public companies such as investors, shareholders, especially small shareholders, creditors, customers, trading partners and employees, as well as ensuring the overall soundness and credibility of the country’s company law structures."
47,11.txt,"In the words of the Commission’s report (at paragraph 64), ""it is ... necessary in a democratic society that governments exercise supervisory controls over large commercial activities in order to ensure good management practices and the transparency of honest dealings""."
48,11.txt,"As regards the particular facts complained of by the applicant brothers, the Court accepts as accurate the Government’s analysis of the purposes served by the making and publication of the Inspectors’ report (see paragraphs 28 and 58 above - see also paragraphs 13, 14 and 30 above as regards the particular facts)."
49,11.txt,"The investigation into the affairs of HOFH and the publication of the resultant report in themselves therefore pursued legitimate aims."
50,11.txt,"As to the contested limitation on the ability to take legal proceedings, it was common ground that any defamation action brought by the applicants against the Inspectors or the Secretary of State would have been successfully met with a defence of privilege, be it absolute or qualified (see paragraphs 42 and 43 above)."
51,11.txt,The rationale of this defence is that statements which harm an individual’s reputation and which would otherwise give rise to liability should benefit from total or partial immunity because their author or publisher is acting in furtherance of some overriding interest of social importance (see paragraph 42 above).
52,11.txt,"As regards more specifically investigations under the Companies Act, the British courts have explained that ""the public interest demands"" that ""Inspectors should make their report with courage and frankness"" (per Lord Denning in re Pergamon Press Ltd - see paragraph 43 above)."
53,11.txt,"Whilst continuing to maintain that the means employed were disproportionate to the aim pursued, they stressed that their complaint was not directed against the defence of privilege as such. They were not asserting a right to hold the Inspectors or the Secretary of State personally liable for damages in a suit for defamation; nor were they arguing that such independent reports into the affairs of public companies should never be prepared or published."
54,11.txt,"Rather their claim was that where a report by organs of the State has branded an individual as being guilty of wrongdoing such as dishonesty after a procedure not attended by the procedural guarantees of a fair trial, Article 6 para. 1 (art. 6-1) grants the individual whose reputation is at stake the right to challenge the findings against him or her in a court of law before publication of the report. "
55,11.txt,"Accepting that a cause of action based on libel was barred and that judicial review did not provide the desired remedy, some other form of effective access to the courts should have been available to them for this purpose by virtue of Article 6 para. 1 (art. 6-1)."
56,11.txt,"The English legal system, in their view, lacked adequate safeguards to protect their civil right to honour and reputation against misuse of their powers by the Inspectors and the Secretary of State."
57,11.txt,"As to enforcement of the right to a good reputation under domestic law, the limits of acceptable criticism are wider with regard to businessmen"
58,11.txt,"Persons, such as the applicants, who fall into the former category of businessmen inevitably and knowingly lay themselves open to close scrutiny of their acts, not only by the press but also and above all by bodies representing the public interest (ibid.)."
59,11.txt,"(see the Oberschlick v. Austria judgment of 23 May 1991, Series A no. 204, p. 26, para. 59)"
60,11.txt," An additional point to note as concerns the particular circumstances of the present case is that the findings in the Inspectors’ report to which the applicants took exception related to matters which the applicants themselves had made great efforts to bring into the public domain, namely their family background, their personal wealth and their business activities (see paragraphs 9 and 22 above)."
61,11.txt,"The beneficial public reputation which the applicants enjoyed in late 1984 and early 1985 was largely the result of an active public relations campaign which they undertook with the assistance of their advisers, and it played a crucial role in facilitating clearance of their bid for HOF."
62,11.txt,"Thereafter the applicants were at pains to stifle any publicity adverse to this favourable reputation which they had themselves largely created, as is shown by their threatened or actual libel actions against various newspapers, notably The Observer (see paragraph 11 above)."
63,11.txt," In any event, in their argument to the Court the applicants did not suggest that either the Inspectors or the successive Secretaries of State had acted with malicious intent, which would have destroyed a defence of qualified privilege."
64,11.txt," In arriving at their findings of fact or conclusions, the Inspectors were under a duty to act fairly and to give anyone whom they proposed to criticise in their report a fair opportunity to answer the allegations against them."
65,11.txt,"The remedy of judicial review was available to the applicants against the Inspectors or the Secretary of State to challenge the appointment of the Inspectors, the making of the report, its content or its publication if it could be claimed that there had been unfairness or breach of the rules of natural justice or that the findings or conclusions were unreliable on a number of other grounds (see paragraphs 44 and 45 above)."
66,11.txt,"In the latter connection, judicial review would have provided relief if it could have been established that the Inspectors had made findings of fact not properly based on material with probative value, or reached conclusions which there were no facts to support, or taken into account irrelevant considerations or failed to take account of relevant considerations, or reached conclusions which no reasonable person in their position could have reached (ibid.)."
67,11.txt,"Judicial review would not, it is true, have provided the applicants with ""the effective remedy"" to which they were claiming to be entitled under Article 6 para. 1 (art. 6-1), namely a remedy enabling them to argue before a court that the Inspectors’ findings of fact were simply erroneous."
68,11.txt,"Whilst Inspectors are accorded broad freedom in reporting on the affairs of public companies, the performance of their investigative functions is attended by not inconsiderable safeguards intended to ensure a fair procedure and the reliability of findings of fact."
69,11.txt,"Extremely serious accusations were levelled against the Inspectors by the applicants in the press release issued by them on the day of the publication of the Inspectors’ report, including accusations of dishonesty, prejudice, non-respect of agreed procedures, unfairness and total disregard of the principles of natural justice (see paragraph 32 above)."
70,11.txt,"In correspondence with the authorities the applicants had previously been consistently threatening to take legal action to contest the report and its publication; yet in the event they did not do so, despite a formal undertaking on behalf of the Secretary of State to hold up publication if proceedings were brought (see paragraph 29 above)."
71,11.txt,"As the Government pointed out, a reading of the Inspectors’ report shows that the applicants were made aware of the information required of them and were given every reasonable opportunity to respond to the allegations made against them and to furnish evidence, notwithstanding their last-minute procedural request to the Inspectors (see paragraphs 20 and 21 above)."
72,11.txt,"The applicants pointed out that the Inspectors’ report containing findings of dishonesty was published, with the benefit of protection from liability in defamation, even though the authorities decided that there was no cause for instituting either criminal or civil proceedings (see paragraphs 23, 27, 28 and 30 above)."
73,11.txt,"The Court has also taken note of the evidence submitted by the applicants showing that there is a body of informed opinion in the United Kingdom which believes that these consequences of the system enacted by Parliament in the Companies Act 1985 are not desirable."
74,11.txt," It is not, however, for the Court to substitute its own view for that of the national legislature as to what would be the most appropriate policy in this regard."
75,11.txt,"The risk of some uncompensated damage to reputation is inevitable if independent investigators in circumstances such as those of the present case are to have the necessary freedom to report without fear, not only to the authorities but also in the final resort to the public."
76,11.txt,It is in the first place for the national authorities to determine the extent to which the individual’s interest in full protection of his or her reputation should yield to the requirements of the community’s interest in independent investigation of the affairs of large public companies. 
77,11.txt,"The applicants’ argument would amount to reading into Article 6 para. 1 (art. 6-1) an entitlement to have a report such as the one in the present case not published until after a full judicial hearing repeating, doubtless over a longer time-scale, the same fact-finding exercise as that already carried out by the Inspectors."
78,11.txt,Such an entitlement could effectively destroy the utility of informing the public of the results of the administrative investigations provided for under section 432 (2) of the Companies Act 1985.
79,11.txt,"Having found the aim of not only making but also publishing Inspectors’ reports to be legitimate, the Court cannot apply the test of proportionality in such a way as to render publication impracticable."
80,11.txt,"The contested limitation was thus concerned with an investigation of circumstances offered to public scrutiny by persons who had themselves sought a public profile through their bid to take over a large public company."
81,11.txt,"Although the investigation was administrative and not judicial in nature, the Inspectors were bound by what are known under English law as ""the rules of natural justice"" (see paragraph 39 above)."
82,11.txt,"Nonetheless, the manner in which findings detrimental to a person’s reputation are arrived at in an administrative investigation, as well as the objectives pursued by the investigation, is relevant for assessing the permissibility under Article 6 para. 1 (art. 6-1) of a limitation on the person’s opportunities to go to court to enforce his or her civil right to reputation."
83,11.txt,"Safeguards afforded to the applicants throughout the investigation included constant consultation by the Inspectors as regards the structure, procedure and lines of inquiry of the investigation, the professional representation of the applicants, at interviews as well as in the submission of evidence and argument, and the Inspectors’ concern to respect the applicants’ personal privacy as much as possible (see paragraphs 15 to 18 and 20 above)."
84,11.txt," In the light of the foregoing considerations, the Court cannot find that, in the exercise of their responsibility of regulating the conduct of the affairs of public companies, the national authorities exceeded their margin of appreciation to limit the applicant brothers’ access to the courts under Article 6 para. 1 (art. 6-1), either as regards the state of the applicable law or as regards the effects of the application of that law to the brothers."
85,11.txt," The starting-point for the Court’s reasoning is its doctrine that Article 6 (art. 6) ""extends only to ‘contestations’ (disputes) over (civil) ‘rights and obligations’ which can be said, at least on arguable grounds, to be recognised under domestic law"" (paragraph 65).
5.    In my concurring opinion in the case of Salerno v. Italy (judgment of 12 October 1992, Series A no. 245-D, pp. 57 et seq.), I examined the genesis of this doctrine. In paragraph 3.4 of that opinion I recalled that the doctrine had been fundamentally criticised on repeated occasions by several judges , but I left open whether I too subscribed to that criticism. I came to the conclusion that in any event there was no room for the ""arguable claim"" test where the applicant has in fact had access to a court which has decided on the merits of his claim: a decision on a non-arguable claim should also meet the requirements of Article 6 para. 1 (art. 6-1)."
86,11.txt,"The present case demonstrates that also within the context of an access-to-court issue the ""arguable claim"" test is an unfortunate feature of the Court’s case-law ."
87,11.txt,"It has obliged the Court to adopt a reasoning whose subtleness, to my mind, seems hardly convincing."
88,11.txt,"  In my opinion the Court’s reasoning would have been simpler and more persuasive without all this meandering necessitated by its maintaining the ""arguable claim"" test: there could be no doubt as to the applicants’ right to reputation having been damaged."
89,11.txt,"Whether or not a right to reputation is enshrined in Article 8 (art. 8) of the Convention is immaterial, since such a right does exist, at least in principle, under all our national laws and it has not been contended that in this respect English law makes an exception by clearly and fully excluding such a right."
90,11.txt,"Neither can there be doubt as to the right to reputation being a ""civil"" right within the autonomous meaning of that notion under Article 6 para. 1 (art. 6-1)."
91,11.txt,"It follows that under this provision, whenever a person’s reputation has been interfered with, he or she is in principle entitled to access to a court meeting its requirements."
92,11.txt,"In the applicants’ submission, one of the objects of the inquiry by the Inspectors was to make findings as to whether the applicants were guilty of misconduct and the central conclusion of the report was that the applicants had dishonestly misled the authorities."
93,11.txt,"Even though the Inspectors’ role may in theory have been investigative, the manner in which they performed their functions in the present case was in fact determinative."
