id,name,argument
94,11.txt,"The Inspectors’ report, published to the world at large, had the force of a judgment convicting the applicants of dishonesty."
95,11.txt," Having regard to the cases of Golder v. the United Kingdom (judgment of 21 February 1975, Series A no. 18, p. 13, para. 27) and Helmers v. Sweden (judgment of 29 October 1991, Series A no. 212-A, p. 14, para. 27),"
96,11.txt,"(see, inter alia, the James and Others v. the United Kingdom judgment of 21 February 1986, Series A no. 98, pp. 46-47, para. 81; and the Powell and Rayner v. the United Kingdom judgment of 21 February 1990, Series A no. 172, p.16, para. 36)."
97,11.txt,"[Article 6 para. 1] (art. 6-1) does not in itself guarantee any particular content for (civil) ‘rights and obligations’ in the substantive law of the Contracting States"""
98,11.txt,"Whether a person has an actionable domestic claim may depend not only on the substantive content, properly speaking, of the relevant civil right as defined under national law but also on the existence of procedural bars preventing or limiting the possibilities of bringing potential claims to court."
99,11.txt,In the latter kind of case Article 6 para. 1 (art. 6-1) may have a degree of applicability.
100,11.txt,Certainly the Convention enforcement bodies may not create by way of interpretation of Article 6 para. 1 (art. 6-1) a substantive civil right which has no legal basis in the State concerned.
101,11.txt,"The relevant principles have been stated by the Court as follows:"
102,11.txt,"The right of access to the courts secured by Article 6 para. 1 (art. 6-1) is not absolute but may be subject to limitations; these are permitted by implication since the right of access ‘by its very nature calls for regulation by the State, regulation which may vary in time and in place according to the needs and resources of the community and of individuals’."
103,11.txt," In laying down such regulation, the Contracting States enjoy a certain margin of appreciation, but the final decision as to observance of the Convention’s requirements rests with the Court."
104,11.txt,"(see, inter alia, the James and Others v. the United Kingdom judgment of 21 February 1986, Series A no. 98, pp. 46-47, para. 81; and the Powell and Rayner v. the United Kingdom judgment of 21 February 1990, Series A no. 172, p.16, para. 36)."
